Kansas City stock yards, Oct. 15, 1907 [graphic].	undefined	United States Missouri Kansas City.
Fourth anniversary of consrecration [sic] of Zion Temple site, July, 1904, Zion City, Ill. [graphic].	undefined	United States Illinois Zion.
Industrial parade, July 1904, Zion City, Ill. [graphic].	undefined	United States Illinois Zion.
Converts' rally, Evangelistic Committee of New York City, Carnegie Hall, Sept. 14, 1908 [graphic].	undefined	United States New York (State) New York.
Shiloh Tabernacle, July 17, 1904, Zion City, Ill. [graphic].	undefined	United States Illinois Zion.
Zion City, Ill. [graphic].	undefined	United States Illinois Zion.
Panama City from Ancon Hill [graphic].	undefined	Panama Panama.
Zion Industries at Shiloh Tabernacle, July 1904, Zion City, Ill. [graphic].	undefined	United States Illinois Zion.
6th Cavalry Camp, mobilized at Texas City, Texas [graphic].	undefined	United States Texas Texas City.
4th Field Artillery & Engineers Camp, Texas City, Texas, 1914 [graphic].	undefined	United States Texas Texas City.
Mobilization Camp, 2nd Div. (less 5th Brigade), Texas City, Texas, 1914 [graphic].	undefined	United States Texas Texas City.
Mobilization Camp, 2nd Div. (less 5th Brigade, 11th & 22nd Inf's.), Texas City, Texas, 1914 [graphic].	undefined	United States Texas Texas City.
Mobilization Camp, 23rd, 26th and 27th Regiments, Texas City, Tex. [graphic].	undefined	United States Texas Texas City.
Mobilization camp, 11th, 18th & 22nd Inf., Texas City, Tex. [graphic].	undefined	United States Texas Texas City.
Tent City, Camp Dodge, Iowa [graphic].	undefined	United States Iowa.
[San Diego, Cal., the exposition city] [graphic].	undefined	United States California San Diego.
Birds eye view of entire mobilization camp, 4th and 6th Brigade, 2nd Division, Texas City [graphic].	undefined	United States Texas Texas City.
Flying Machines Aero Squadron, Mobilization Camp, Texas City, 1913 [graphic].	undefined	United States Texas Texas City.
Brigade of infantry, Texas City, Texas; Brig. Gen. Hunter Liggett, commanding; Major L.L. Durfee, adjutant. [graphic].	undefined	United States Texas Texas City.
Officers, 4th and 6th Brigade, 2nd Div., Texas City, April 1913 [graphic].	undefined	United States Texas Texas City.
Officers, 4th and 6th Brigade, 2nd Div., Texas City, April 1913 [graphic].	undefined	United States Texas Texas City.
Officers, 4th and 6th Brigade, 2nd Div., Texas City, April 1913 [graphic].	undefined	United States Texas Texas City.
6th Cavalry corral & camp, Texas City, Tex., 1913 [graphic].	undefined	United States Texas Texas City.
26th Regt. of Infantry, Col. R.L. Bullard, commanding, mobilization camp, Texas City, 4/14/13 [graphic].	undefined	United States Texas Texas City.
City Hall Park panorama [graphic].	undefined	United States New York (State) New York.
39th Annual Conference, National Association for the Advancement of Colored People, June 22-27, 1948, Kansas City, Mo. [graphic].	undefined	United States Missouri Kansas City.
View of Baltimore City, Md., from the North [graphic] / lith. & print by E. Sachse & Co. 104 S. Charles St. Baltimore.	1862	United States Maryland Baltimore.
View of Baltimore City, Md., looking South [graphic] / lith. & print by E. Sachse & Co. 5 N. Liberty St. Balto.	1872	United States Maryland Baltimore.